{
  "name": "plumbing",
  "folder": "home",
  "description": "Pipes, taps, drains, toilets and water heaters: fixing and fitting.",
  "sides": "two",
  "evidenceTypes": ["escrow"],
  "offerFields": {
    "properties": {
      "appointmentWindowHours": {
        "type": "integer",
        "description": "How wide the arrival window is, in hours: the seller arrives within this many hours of the booked time.",
        "minimum": 0
      }
    }
  },
  "reviewFields": {},
  "ratings": ["overall", "punctuality"],
  "howDealsGo": "The buyer books a visit and pays into escrow. Done is the job working when the plumber leaves, and the buyer releases then. A timer to the seller, set past the visit, pays for work done if the buyer goes quiet. Before paying, agree whether parts are in the price."
}
