{
  "name": "motorcycles",
  "folder": "vehicles",
  "description": "Motorcycles and scooters, new or used.",
  "sides": "two",
  "evidenceTypes": ["escrow"],
  "offerFields": {
    "properties": {
      "condition": {
        "type": "string",
        "description": "The item's condition.",
        "knownValues": ["new", "like-new", "good", "fair", "for-parts"],
        "maxLength": 64
      },
      "year": {
        "type": "integer",
        "description": "The year it was made."
      },
      "mileageKm": {
        "type": "integer",
        "description": "Distance driven so far, in kilometres.",
        "minimum": 0
      }
    }
  },
  "reviewFields": {},
  "ratings": ["overall", "accuracy"],
  "howDealsGo": "Buyer and seller meet, the buyer inspects and rides it, and the buyer pays into escrow before the handover. Done is the motorcycle, its keys and its signed papers handed over, and the buyer releases then. With a large amount, an arbiter both trust is worth naming. Before paying, check the papers name the seller and the frame number matches them."
}
