{
  "name": "hairdressing",
  "folder": "health-and-beauty",
  "description": "Haircuts, colour and styling, at a salon or at home.",
  "sides": "two",
  "evidenceTypes": ["escrow"],
  "offerFields": {
    "properties": {
      "homeVisits": {
        "type": "boolean",
        "description": "True when the seller comes to the buyer's place."
      }
    }
  },
  "reviewFields": {},
  "ratings": ["overall", "punctuality"],
  "howDealsGo": "The buyer pays into escrow at booking and releases after the appointment, or pays and releases in one tap at the end. Done is the cut or colour as agreed. A timer to the seller, set past the appointment, pays for work done if the buyer goes quiet. Before paying, show a photo of what you want."
}
