{
  "name": "electrical",
  "folder": "home",
  "description": "Wiring, sockets, lights and fuse boxes: fixing and fitting.",
  "sides": "two",
  "evidenceTypes": ["escrow"],
  "offerFields": {
    "properties": {
      "appointmentWindowHours": {
        "type": "integer",
        "description": "How wide the arrival window is, in hours: the seller arrives within this many hours of the booked time.",
        "minimum": 0
      }
    }
  },
  "reviewFields": {},
  "ratings": ["overall", "punctuality"],
  "howDealsGo": "The buyer books a visit and pays into escrow. Done is the fault fixed or the fitting working, tested with the electrician there, and the buyer releases then. A timer to the seller, set past the visit, pays for work done if the buyer goes quiet. Before paying, ask whether the work needs a certificate where you live."
}
